"0818-06042026","Incendio Forestal en CASTAÑERA (Belmonte de Miranda ) ","06/04/2026 20:46","Belmonte de Miranda","CASTAÑERA",,,,,"Extinguido",,"06/04/2026 22:38","QUEMA UN BORRÓN",,"43.294777","-6.22945","3","07/04/2026 05:48","SALA 112"
"0836-06042026","Incendio Forestal en COBAYAS (Piloña ) ","06/04/2026 21:01","Piloña","COBAYAS",,,,,"Extinguido",,"07/04/2026 02:26",,,"43.318018","-5.44366","6","07/04/2026 05:42","SALA 112"
"0846-06042026","Incendio Forestal en Ponga","06/04/2026 21:16","Ponga","TARANES, TÍATORDOS",,,,,"Extinguido",,"06/04/2026 23:09","VARIOS PUNTOS PROVOCADOS EN ZONA MUY ALTA SIN PELIGRO. REVISARA GUARDERIA MAÑANA A PRIMERA HORA.","Guardería","43.18103","-5.17371",,"07/04/2026 11:43","CAROLINA SECADES CARRILLO"
"0849-06042026","Incendio Forestal en LA FRECHA (Piloña ) ","06/04/2026 21:16","PILOÑA","LLAMES DE PARRES, EL PICO, TOSPE",,,,"07/04/2026 03:56","Extinguido","Moderado (1)","06/04/2026 23:05",,,"43.353885","-5.21549","15","07/04/2026 12:44","CAROLINA SECADES CARRILLO"
"0867-06042026","Incendio Forestal en CUBO PUERTO (Cangas del Narcea ) ","06/04/2026 21:31","Cangas del Narcea","Cubo Puerto","Bomberos Tebongo, Bripas, Lote 8. ","[""Lote 8""]",,,"Extinguido",,"06/04/2026 22:25",,"Bomberos","43.201781","-6.6547",,"07/04/2026 21:19","SALA 112"
"0902-06042026","Incendio Forestal en LLANO DE CON (Cangas de Onís ) ","06/04/2026 22:01","Cangas de Onís","Llano de Con","Bomberos Cangas de Onís",,,,"Extinguido",,"07/04/2026 11:20",,"Bomberos","43.328319","-5.0146","10","07/04/2026 16:26","SALA 112"
"0824-06042026","INCENDIO FORESTAL","06/04/2026 22:00","CABRALES","CAMARMEÑA","GUARDERIA DEL PARQUE NACIONAL",,,,"Extinguido",,"06/04/2026 21:15","INCENDIO DENTRO DEL PARQUE NACIONAL. EN ZONA INACCESIBLE A TENOR DEL DIRECTOR DEL PARQUE. MAÑANA A PRIMERA HORA INFORMARA GUARDERIA DEL PARQUE PARA EL ENVIO DE MEDIOS AEREOS.",,,,,"07/04/2026 11:36","CAROLINA SECADES CARRILLO"
"0907-06042026","Incendio Forestal en TRUÉBANO (Tineo ) ","06/04/2026 22:16","Tineo","Truébano. ",,,,,"Extinguido","Moderado (1)","07/04/2026 07:41",,,"43.368107","-6.40757","4","07/04/2026 22:27","SALA 112"
"0935-06042026","Incendio Forestal en PERANDONES (Cangas del Narcea ) ","06/04/2026 22:46","Cangas del Narcea","PERANDONES","1 BB C NARCEA Y LOTE 5","[""Lote 5""]","07/04/2026 01:39",,"Extinguido","Bajo (0)","07/04/2026 01:40",,,"43.137573","-6.58644",,"07/04/2026 14:07","SALA 112"
"0942-06042026","Incendio Forestal en TOLIVIA (Laviana ) ","06/04/2026 22:46","Laviana","TOLIVIA",,,,,"Extinguido",,"07/04/2026 04:20",,,"43.211565","-5.58315","15","07/04/2026 05:26","SALA 112"
"0963-06042026","Incendio Forestal en Lena","06/04/2026 23:01","Lena","Alto del Cordal","Bomberos Mieres, Lote 23","[""Lote 23""]",,,"Extinguido","Moderado (1)","07/04/2026 16:01",,"Bomberos","43.081426","-5.85938","28","07/04/2026 16:41","SALA 112"
"0990-06042026","Incendio Forestal en RIERA (LA) (Cangas de Onís ) ","06/04/2026 23:31","Cangas de Onís","LA RIERA","BB CANGAS DE ONÍS",,,,"Extinguido","Bajo (0)","07/04/2026 10:50","VE QUEMAR ARBOLADO EN ZONA ALTA","Bomberos","43.324436","-5.07861","5","07/04/2026 12:20","CAROLINA SECADES CARRILLO"
"0982-06042026","Incendio Forestal en SAN ANDRES (Gijón ) ","06/04/2026 23:31","Gijón",,,,,,"Extinguido",,"07/04/2026 01:15","VE FUEGO EN EL MONTE. LO VE DESDE TRUBIA. SE TRANSFIERE CON BB OVIEDO",,"43.509076","-5.77029",,"07/04/2026 05:19","SALA 112"
"0999-06042026","Incendio Forestal en VALLES (Piloña ) ","07/04/2026 00:01","Piloña","VALLES",,,,,"Extinguido","Bajo (0)","07/04/2026 04:27","DOS FRENTES VIGILADOS PARA EVITAR QUE CRUCEN LA PISTA",,"43.340493","-5.33284","8","07/04/2026 11:45","CAROLINA SECADES CARRILLO"
"1001-06042026","Conato en BLIMEA (San Martín del Rey Aurelio ) ","07/04/2026 00:01","San Martín del Rey Aurelio",,,,,,"Extinguido",,"07/04/2026 01:54","QUEMA SIN IMPORTANCIA",,"43.273383","-5.58933",,"07/04/2026 05:08","SALA 112"
"1005-06042026","Incendio Forestal en AVIN (Onís ) ","07/04/2026 00:01","Onís","AVÍN",,,,,"Extinguido",,"07/04/2026 01:50",,,"43.334779","-4.95161","2","07/04/2026 05:14","SALA 112"
"0014-07042026","Incendio Forestal en PALACIO (Grado ) ","07/04/2026 00:31","Grado","Ballongo/ Palacio / Pumarín","Bomberos Grado",,,,"Extinguido",,"07/04/2026 00:49",,,"43.308191","-6.02449","2","07/04/2026 22:29","SALA 112"
"0068-07042026","Incendio Forestal en LABRA (Cangas de Onís ) ","07/04/2026 02:31","Cangas de Onís","LABRA",,,,,"Extinguido",,"07/04/2026 04:22","ALERTANTE LLAMA DESDE CERCA DE LABRA. VE EN ZONA DE MONTAÑA EN PICO. VE ARBOLEDA QUEMANDO. SE UNE CON EL DE CEBIA",,"43.360902","-5.05827",,"07/04/2026 11:38","CAROLINA SECADES CARRILLO"
"0079-07042026","Incendio Forestal en PERLAVIA (OVIEDO)","07/04/2026 03:16","OVIEDO","PERLAVIA",,,,,"Extinguido",,"07/04/2026 06:27","VIVIENDA A 200M DEL FRENTE QUE AVANZA DESPACIO",,"43.333499","-6.01336",,"07/04/2026 06:28","SALA 112"
"0895-06042026","Incendio Forestal en Morcín","07/04/2026 05:46","Morcín","Sierra del Aramo",,,,,"Extinguido",,"07/04/2026 07:40",,,"43.063604","-5.90945",,"07/04/2026 22:00","SALA 112"
"0133-07042026","Incendio Forestal en PIEDRATECHA (Tineo ) ","07/04/2026 06:16","Tineo","PIEDRATECHA","BB TINEO, LOTE 31",,,,"Extinguido",,"07/04/2026 11:09","ESTABILIZADO CON PUNTOS CALIENTE",,"43.330965","-6.469",,"07/04/2026 13:11","SALA 112"
"0851-06042026","Incendio Forestal en CAMARMEÑA (Cabrales ) ","07/04/2026 08:01","Cabrales",,"EXTINGUIDO",,,,"Extinguido",,"07/04/2026 09:57","GUARDERIA DE PARQUE NACIONAL DA EXTINGUIDO INCENDIO",,"43.258904","-4.83662",,"07/04/2026 11:36","CAROLINA SECADES CARRILLO"
"0177-07042026","Incendio Forestal en BENIA DE ONIS (Onís ) ","07/04/2026 08:31","Onís",,,,,,"Extinguido","Bajo (0)","07/04/2026 10:14","INFORMA DE UN INCENDIO AL SUR DE BENIA Y OTRO AL SUR DE AVÍN. QUEMA MATORRAL Y ALGO DE ARBOLADO. NO SABE SOBRE ACCESOS.",,"43.334766","-4.96813",,"07/04/2026 12:14","CAROLINA SECADES CARRILLO"
"0191-07042026","Incendio Forestal en BENIA DE ONIS (Onís ) ","07/04/2026 09:01","Onís","Benia",,,,,"Extinguido",,"07/04/2026 10:56",,,"43.334766","-4.96813",,"07/04/2026 22:01","SALA 112"
"0268-07042026","Incendio Forestal en CAMPAS (LAS) (Oviedo ) ","07/04/2026 11:16","Oviedo","LAS CAMPAS",,,,,"Extinguido",,"07/04/2026 13:00","VE UN INCENDIO FORESTAL CERCA DE LA CARRETERA  SE TRANSFIERE CON BB DE OVIEDO",,"43.365973","-5.88831",,"07/04/2026 16:00","CAROLINA SECADES CARRILLO"
"0306-07042026","Incendio Forestal en TRUBIA (Oviedo ) ","07/04/2026 12:31","Oviedo",,,,,,"Extinguido",,"07/04/2026 14:19","COS NOS PASA OTRA LLAMADA SOBRE ESTE AVISO.",,"43.345524","-5.97262",,"07/04/2026 16:01","CAROLINA SECADES CARRILLO"
"0438-07042026","Incendio Forestal en PICO (EL) (Piloña ) ","07/04/2026 14:46","Piloña","El Pico","Bomberos Piloña",,,,"Extinguido","Bajo (0)","07/04/2026 16:38",,,"43.311659","-5.23797","3","07/04/2026 17:24","SALA 112"
"0470-07042026","Incendio Forestal en YERNES (Yernes y Tameza ) ","07/04/2026 15:31","Yernes y Tameza","Yernes","Bomberos Pravia",,,,"Extinguido",,"07/04/2026 17:13",,"Guardería","43.279557","-6.11004",,"07/04/2026 22:13","SALA 112"
"0504-07042026","Incendio Forestal en NOVALES (Oviedo ) ","07/04/2026 16:01","Oviedo","Novales",,,,,"Extinguido",,"07/04/2026 17:53",,,"43.325458","-5.8263",,"07/04/2026 22:31","SALA 112"
"0540-07042026","Incendio Forestal en COLLADA (LA) (Morcín ) ","07/04/2026 16:31","Morcín","La Collada","Bomberos del parque de Mieres. ","[""Lote 23""]","07/04/2026 16:40",,"Extinguido",,"07/04/2026 16:19","Miembro de la Bripa de La Morgal informa de este incendio. 
Extinción gracias a la lluvia. ",,"43.268087","-5.87528",,"07/04/2026 17:56","SALA 112"
"0525-07042026","Incendio Forestal en CARRICEDO (Belmonte de Miranda ) ","07/04/2026 16:31","Belmonte de Miranda","Carricedo. ","Agente medioambiental de Belmonte y Bomberos de parque de Grado. ",,,,"Extinguido",,"07/04/2026 18:25","SE INFORMA A JZ",,"43.284386","-6.26379","1","07/04/2026 20:14","SALA 112"
"0372-07042026","Incendio forestal","07/04/2026 13:21","Grado","Rubiano","Agente medioambiental. ",,,,"Extinguido",,"07/04/2026 16:34","Incendio contigua a otra quemada. Sin cuantificar su extensión. ",,,,,"07/04/2026 16:36","SALA 112"
"0639-07042026","Incendio Forestal en FUENTESANTA (Nava ) ","07/04/2026 18:31","Nava",,,,,,"Extinguido",,"07/04/2026 20:25","SE INFORMA A JZ",,"43.346521","-5.48394",,"07/04/2026 21:20","SALA 112"
"0963-06042026","ALTO DE EL CORDAL","07/04/2026 21:28","LENA","ALTO DE EL CORDAL","GF",,,,"Extinguido",,"07/04/2026 21:28",,"Nadie",,,,"07/04/2026 21:30","SALA 112"
"0825-07042026","Incendio Forestal en MERODIO (Peñamellera Baja ) ","07/04/2026 21:31","Peñamellera Baja","Cercanías del área recreativa del argayo. ",,,,,"Extinguido",,"07/04/2026 23:27","Foco de incendio que se apaga por sí solo. ",,"43.319344","-4.54003",,"07/04/2026 22:08","SALA 112"
,,"26/02/2026 16:26",,"PARAJAS",,,,,"Extinguido","Moderado (1)","26/02/2026 17:12","QUEMA MATORRAL, HAY ALGUN ARBOL PEQUEÑO.
HAY LLAMAS DE MEDIO METRO.","Guardería","431210N","063505W",,"25/03/2026 23:04","SALA 112"
,,"22/03/2026 15:45",,"CERCA DE EÓLICOS, SIERRA DE LOS LAGOS",,,,,"Extinguido",,"23/03/2026 11:27","QUEMARON 2 HAS DE MATORRAL",,"43º15´15´´","6º43´50´´","2","23/03/2026 11:50","SALA 112"
,,"22/03/2026 23:09",,"DESDE EL PUERTO DEL PALO, DESVÍO HACIA EL ALTO DE LA MARTA",,,,,"Extinguido","Bajo (0)","23/03/2026 02:30","LO DAN POR EXTINGUIDO",,,,"6","23/03/2026 02:58","SALA 112"
,,"24/03/2026 19:10",,"CUBOPUERTO, DEBAJO DE LOS EÓLICOS DEL PUERTO DEL PALO",,,,,"Extinguido",,"24/03/2026 19:10",,,,,,"25/03/2026 02:09","SALA 112"
,,"24/03/2026 20:30",,"SIERRA DE LA PILA",,,,,"Extinguido",,"24/03/2026 20:30",,"Nadie",,,,"25/03/2026 12:06","SALA 112"
,,"26/02/2026 18:13",,"BELLO","3 BB MIERES
GUARDERÍA",,,,"Extinguido",,"26/02/2026 18:45","A LAS 18:45 EL GUARDA  INFORMA DE QUE QUEMA UNA LADERA DE MATORRAL, HAY UNA CABAÑA A 100M. RODEADA DE HELECHO, AHORA NO TIRA AIRE, SUBE UNA COLUMNA VERTICAL ",,"430825N","053639W",,"26/02/2026 22:30","SALA 112"
,,"01/03/2026 15:53",,"CORDAL DE LA ZORRA. PICO CUETO",,,,,"Extinguido","Bajo (0)","01/03/2026 16:50","ILO DAN POR EXTINGUIDO",,,,"3","01/03/2026 19:22","SALA 112"
,,"03/03/2026 00:46",,"OYANCO",,,,,"Extinguido",,"03/03/2026 04:24",,,"43º 11´ 22""","5º 42´ 48""","9","03/03/2026 20:03","SALA 112"
,,"04/03/2026 12:15",,"Pelugano",,,,,"Extinguido",,"04/03/2026 12:15",,,,,,"12/03/2026 15:43","SALA 112"
,,"04/03/2026 13:34",,"Cotobello",,,,,"Extinguido",,"04/03/2026 13:34",,,,,,"04/03/2026 15:37","SALA 112"
,,"04/03/2026 15:57",,"LA CORTINA",,,,,"Extinguido",,"04/03/2026 15:57","QUEMA EN UNA PRADERÍA, SE DESCONTROLÓ",,,,,"04/03/2026 17:21","SALA 112"
,,"04/03/2026 21:27",,"LLANANZANES",,,,,"Extinguido",,"04/03/2026 21:27",,"Nadie","43º 3´ 51""","5º 34´ 33""",,"05/03/2026 12:52","SALA 112"
,,"04/03/2026 22:02",,"LA ROZA, COTOBELLO","2 BBS MORGAL",,,,"Extinguido",,"04/03/2026 22:02","Sin determinar",,"43º 10´ 10""","5º 40´ 45""","0,5","05/03/2026 14:53","SALA 112"
,,"13/03/2026 14:18",,"XAGUAL",,,,,"Extinguido",,"13/03/2026 14:18",,,,,,"13/03/2026 14:58","SALA 112"
,,"13/03/2026 13:54",,"AS-112 PK 38 SUBIENDO AL PUERTO SAN ISIDRO",,,,,"Extinguido",,"13/03/2026 17:55",,,,,"2","14/03/2026 00:29","SALA 112"
,,"20/03/2026 20:24",,"LLANAS","2 BB DE MIERES",,,,"Extinguido",,"21/03/2026 17:00","17:00 BB LO DAN POR EXTINGUIDO",,,,"28","21/03/2026 17:59","SALA 112"
,,"21/03/2026 09:50",,"RIOMAÑÓN, SIERRA DE FUENTES DE INVIERNO",,,,,"Extinguido",,"21/03/2026 09:50","SE TRATA DEL MISMO INCENDIO QUE HAY EN  LLAMAS.","Bomberos",,,,"21/03/2026 11:08","SALA 112"
,,"21/03/2026 14:39",,"BELLO",,,,,"Extinguido",,"21/03/2026 16:00","SOFOCADO POR H/C Y PARTICULARES DEL PUEBLO",,,,"0,3","21/03/2026 17:04","SALA 112"
,,"21/03/2026 22:57",,"Por encima de Pelúgano. ","2 Bomberos de Mieres. ",,,,"Extinguido",,"22/03/2026 02:56",,,,,,"22/03/2026 04:32","SALA 112"
,,,,"Villaverde",,,,,"Extinguido","Bajo (0)","26/02/2026 10:28",,,"43.256","-5.140","5","26/02/2026 12:19","SALA 112"
,,,,"Vega de Sebarga",,,,,"Extinguido",,"26/02/2026 13:27",,,"43.27682037811383","-5.164087147918789",,"26/02/2026 13:28","SALA 112"
,,"24/02/2026 15:32",,"VILLAVERDE",,,,,"Extinguido",,"27/02/2026 11:04",,,"43.253","-5.144","5","27/02/2026 11:21","SALA 112"
,,"26/02/2026 16:59",,"PEN",,,,,"Extinguido",,"27/02/2026 07:28",,,"43.271","-5.150",,"27/02/2026 07:44","SALA 112"
,,"02/03/2026 00:00",,"ENTRE CIEN Y SAN ROMAN-ARROLLO COLÍN",,,,,"Extinguido","Moderado (1)","02/03/2026 01:40","INCENDIO EXTINGUIDO. BB DE CANGAS DE ONÍS RETIRANDO",,"43.252","-5.090",,"02/03/2026 11:30","SALA 112"
,,"02/03/2026 20:34",,"QUINTANAL  Y VILLAR DE ZUEPOS","2 BOMBEROS DE PRAVIA, 3 BB GRADO, 2 AUX SOMIEDO, LOTE 35",,,,"Extinguido",,"03/03/2026 05:04",,"Nadie","43º 13 ´2""","6º 16´ 44""",,"03/03/2026 18:39","SALA 112"
,,"04/03/2026 19:27",,"LONGORIA, SAN BARTOLOME, CAPITULO, SIERRA DEL PEDRORIO, CUTIELLOS // SIERRA DEL PEDRORIO",,,,,"Extinguido",,"04/03/2026 19:27",,,"43º 20' 32'' N","6º 10' 15'' W",,"05/03/2026 17:15","SALA 112"
,,"04/03/2026 20:01",,"LLAMOSO",,,,,"Extinguido",,"04/03/2026 20:01","EL INCENDIO LO REPORTAN LOS AUXILIARES SOMIEDO QUE SE DIRIGEN A OTRO
09:10 h. día 6 GUARDERIA LO DA POR EXTINGUIDO, LLOVIO MUCHO EN LA ZONA.",,"43º 13´29""","6º 13´ 13""",,"06/03/2026 12:21","SALA 112"
,,"04/03/2026 21:25",,"VILLAR DE ZUEPOS",,,,,"Extinguido",,"04/03/2026 21:25","No se puede cuantificar lo quemado debido a que es de noche. ",,"43º 13´ 9""","6º 17´ 65""",,"22/03/2026 06:33","SALA 112"
,,"04/03/2026 23:07",,"Vigaña",,,,,"Extinguido",,"04/03/2026 23:07","AUX DE SOMIENDO CUANDO TRATABAN DE ENCONTAR ACCESO AL INCENDIO DE LLAMOSO VEN 4 FOCOS POR ENCIMA DEL PUEBLO DE VIGANA",,"43º 4´ 53""","5º 51´ 34""",,"06/03/2026 11:52","LUCIA BLANCO COSTALES"
,,"19/03/2026 16:10",,"Cercanías del pueblo de Fresneo, subiendo a Las Estacas. ","4 Bomberos de Tineo. 
Agente medioambiental, alertante, y de camino al lugar. ",,,,"Extinguido",,"19/03/2026 17:08",,,"43º17'41""","006º13'46""",,"19/03/2026 18:04","SALA 112"
,,"19/03/2026 17:12",,"Cercanías del pico Porcabezas. ","2 Bomberos de Grado. 
Brif de Tineo. ",,,,"Extinguido",,"19/03/2026 19:25",,,"43 14 03","06 11 59","2","19/03/2026 20:59","SALA 112"
,,"21/03/2026 22:16",,"VILLAR DE ZUEPOS","2 AUX SOMIEDO",,,,"Extinguido",,"22/03/2026 04:20","No se puede precisar la extensión de lo quemado al ser de noche. ",,,,,"22/03/2026 06:26","SALA 112"
,,"22/03/2026 13:04",,"ZONA DEL ACEBAL","
",,,,"Extinguido","Moderado (1)","22/03/2026 13:04",,,,,,"22/03/2026 19:05","SALA 112"
,,"02/03/2026 18:38",,"LA BARAGAÑA",,,,,"Extinguido",,"02/03/2026 18:38","QUEMO 1 HA DE MALEZA EN UN PRADO",,"43º 20´ 9¨  ","5º  35´ 9¨","1","02/03/2026 20:02","SALA 112"
,,"19/03/2026 20:06",,"Desde el refugio de Fayacaba hacia Melendreros","2 Bomberos de Piloña. ",,,,"Extinguido",,"19/03/2026 20:21",,,"43º18'44""","005º31'39""",,"19/03/2026 22:02","SALA 112"
,,"21/03/2026 18:47",,"VIÑAY",,,,,"Extinguido",,"21/03/2026 19:58","ERA UN HOMBRE QUEMANDO, PROCEDIERON A APAGARLO",,"43 18 39 N","5 33 29 O",,"21/03/2026 21:44","SALA 112"
,,"26/02/2026 16:06",,"ASIEGO","2 BB. CANGAS DE ONÍS

",,,,"Extinguido","Bajo (0)","26/02/2026 19:12"," YA QUEMADAS 10 HECTÁREAS. BBS C.ONIS DAN EL INCENDIO POR CONTROLADO, NO HAY LLAMAS, ESTÁ FRÍO. REVISANDO EL PERÍMETRO.",,,,,"26/02/2026 19:44","SALA 112"
,,"20/03/2026 20:15",,"Alto de Ortiguero","2 BB C. DE ONIS. 21:20 LO DAN POR EXTINGUIDO",,,,"Extinguido",,"20/03/2026 21:20","QUEMA MONTE BAJO",,,,"1","20/03/2026 21:25","SALA 112"
,,"21/03/2026 13:29",,"PICO IBEU",,,,,"Extinguido",,"21/03/2026 18:34","QUEMA PASTO. ZONA CON MUCHAS LÍNEAS ELÉCTRICAS. 18:34 EXTINGUIDO",,,,"15","21/03/2026 18:56","SALA 112"
,,"23/03/2026 17:40",,"COLLADAS",,,,,"Extinguido",,"23/03/2026 17:40",,,,,"30","23/03/2026 20:31","SALA 112"
,,"23/03/2026 21:47",,"CARREÑA","Revisado por bomberos que comunican su total extinción.",,,,"Extinguido","Bajo (0)","24/03/2026 07:08",,"Bomberos","43 19 0 N  ","4 50 45 O",,"24/03/2026 08:08","SALA 112"
,,"24/03/2026 20:29",,"ASIEGO",,,,,"Extinguido",,"24/03/2026 20:29",,"Bomberos",,,,"25/03/2026 12:04","SALA 112"
,,"24/03/2026 20:28",,"INCOS","2 BBS VILLAVICIOSA",,,,"Extinguido",,"24/03/2026 20:28",,,,,"0,5","25/03/2026 00:21","SALA 112"
,,"01/03/2026 13:22",,"Llamero","2 BB Grado+ GUARDERÍA FORESTAL",,,,"Extinguido",,"01/03/2026 13:22","PARTICULAR INFORMA DE FUERTE COLUMNA DE HUMO NEGRO
 SE TRATA DE UNA QUEMA CONTROLADA SIN PELIGRO. 
BB RETIRAN.",,,,,"01/03/2026 13:44","SALA 112"
,,,,"Llano de Con",,,,,"Extinguido",,,"FRENTE DE GRANDES DIMENSIONES",,"43.323031993147744","-5.019543044708619","12","12/03/2026 15:44","SALA 112"
,,,,"Nieda","3 BB (C.onis)
Lote 26",,,,"Extinguido",,,"HAY DOS FRENTES. EL QUE VA HACIA
SEGÜENCO ES BASTANTE GRANDE
",,"43.341078618735736","-5.121333291224399",,"25/02/2026 16:58","ADRIAN CASTRO LEIVA"
,,,,"Zardón","PENDIENTE REVISIÓN GUARDERÍA",,,,"Extinguido",,"26/02/2026 13:25","
","Nadie","43.394","-5.037",,"03/03/2026 05:10","SALA 112"
,,"26/02/2026 17:46",,"TARANO",,,,,"Extinguido","Moderado (1)","26/02/2026 19:21","BBS C ONIS DAN POR EXTINGUIDO. ","Nadie","432148N","050219W",,"27/02/2026 00:53","SALA 112"
,,"02/03/2026 10:20",,"ENTRE NIEDA Y SEGÜENCO","2 BB DE CANGAS DE ONÍS",,,,"Extinguido",,"02/03/2026 10:20","12:47 BB DAN INCENDIO EXTINGUIDO, PERÍMETRO FRÍO SIN HUMEAR",,"43.330494","-5.114339",,"02/03/2026 12:48","SALA 112"
,,"02/03/2026 13:40",,"ZARDÓN",,,,,"Extinguido",,"02/03/2026 13:40","14:09 BB EN ZONA INACCESIBLE, QUEMA MATORRAL Y SOLICITAN MEDIOS AÉREOS. 
HA ESTADO TRABAJANDO H/C BB-01 EN EL INCENDIO. A LAS 18.15 H LO HA DEJADO PARA ACUDIR A OTROS AVISOS. QUEDABA, SEGÚN INDICA, CASI REMATADO.
18.41 H BB DE C. DE ONÍS LO DAN POR EXTINGUIDO Y RETIRAN. ",,"43º22´35´´","05º02´06´´","2","02/03/2026 18:42","SALA 112"
,,"03/03/2026 18:37",,"LLERICES",,,,,"Extinguido","Moderado (1)","03/03/2026 18:37",,,"43º 18´ 44""","5º 3´ 35""","1","03/03/2026 22:16","SALA 112"
,,"03/03/2026 20:10",,"SANTIANES DE OLA",,,,,"Extinguido","Bajo (0)","04/03/2026 00:51"," NO SABE UBICARLO Y CREE QUE ES PEQUEÑO.
22:44 H. BBS. EN LA ZONA. FUEGO LOCALIZADO, BUSCAN ACCESO. NO PELIGRAN EDIFICACIONES.
00:51 H. 2 BB LLANES DAN POR EXTINGUIDO EL INCENDIO. INCENDIO DE MATORRAL ENTRE PEÑAS.",,"43.40333","-5.04583",,"04/03/2026 01:31","SALA 112"
,,"04/03/2026 12:10",,"Següenco","GMF y BRIF",,,,"Extinguido",,"04/03/2026 12:10","Quema controlada",,,,,"05/03/2026 08:38","SALA 112"
,,"04/03/2026 14:34",,"TÁRANO",,,,,"Extinguido",,"04/03/2026 14:34",,,,,,"04/03/2026 21:07","SALA 112"
,,"04/03/2026 19:10",,"LLENIN","2 BB C. ONÍS",,,,"Extinguido",,"04/03/2026 19:10",,,,,,"04/03/2026 21:09","SALA 112"
,,"20/03/2026 16:08",,"Llano de Con",,,,,"Extinguido","Bajo (0)","20/03/2026 17:21","17.21 LO DAN POR EXTINGUIDO",,,,"0,8","20/03/2026 17:42","SALA 112"
,,"24/03/2026 20:29",,"OLICIO",,,,,"Extinguido","Bajo (0)","24/03/2026 21:27","SIN LLAMA EN EL INCENDIO","Guardería",,,,"25/03/2026 09:24","SALA 112"
,,,,"Porciles-Ridera","• 2 BB TEBONGO
• 2 BB TINEO
• LOTE 14
 (MZ LUBIA)",,,,"Extinguido","Moderado (1)","26/02/2026 13:32",,,"43.161","-6.390","100","26/02/2026 13:33","SALA 112"
,,"26/02/2026 17:11",,"Ridea","2 BB. CANGAS DELNARCEA
BRIF DE TINEO
COOP. FORESTAL",,,,"Extinguido",,"26/02/2026 12:51","INFORMADO POR GUARDA",,"43.1680","-6.3998",,"26/02/2026 22:29","SALA 112"
,,"26/02/2026 17:21",,"PARADA LA VIEJA",,,,,"Extinguido","Moderado (1)","27/02/2026 08:22",,,"430401N","062312W","200","27/02/2026 08:22","SALA 112"
,,"03/03/2026 09:32",,"PARADA LA NUEVA",,,,,"Extinguido","Bajo (0)","03/03/2026 09:32","QUEMAN 5 HA DE MATORRAL",,"43º 9´ 8""","6º 26´ 58""","5","03/03/2026 16:25","SALA 112"
,,"04/03/2026 13:42",,"La Linde","GMF + BRIF TINEO",,,,"Extinguido",,"04/03/2026 13:42","QUEMA PROGRAMADA DE LA GUARDERIA CON APOYO DE LA BRIF DE TINEO",,,,,"05/03/2026 08:39","SALA 112"
,,"24/03/2026 12:38",,"LA CUITADA",,,,,"Extinguido",,"25/03/2026 09:00","ESTA TODO APAGADO Y SIN HUMO. ","Bomberos",,,"25","25/03/2026 12:01","SALA 112"
,,"26/03/2026 17:52",,"Parrondo","2 BBS CANGAS DE NARCEA",,,,"Extinguido","Bajo (0)","26/03/2026 17:52",,,,,,"26/03/2026 21:39","SALA 112"
,,"27/03/2026 20:55",,"Noceda de Rengos, zona de La Cuitada",,,,,"Extinguido","Bajo (0)","28/03/2026 18:37","QUEMAN 40 HAS DE MATORRAL",,"43º2´7´´","6º34´21´´","40","28/03/2026 20:13","SALA 112"
,,"12/03/2026 12:32",,"El Fito",,,,,"Extinguido",,"12/03/2026 12:32","VAN A REALLIZAR UNA QUEMA CONTROLADA EN EL FITO VERTIENTE CARAVIA",,,,,"13/03/2026 10:48","SALA 112"
,,,,"Pendones","AUX COBALLES",,,,"Extinguido",,,"QUEMA MATORRAL CERCA DE UN
HAYEDO
",,"43.15279641525894","-5.243275698360225",,"26/02/2026 07:45","ADRIAN CASTRO LEIVA"
,,"01/03/2026 19:51",,"BUERES","2 BB SMRA, LOTE 26

",,,,"Extinguido",,"01/03/2026 23:02","INFORMA GUARDA DE REDES, FLANCO DE 300 M DE MONTE BAJO Y REBOLLO . VAN A EMPEZAR A APAGAR EL FLANCO IZQDO QUE TIENE UNOS 100 M, EL DCHO NO VEN HASTA DONDE LLEGA, SOLICITAN MÁS PERSONAS. 22:23 CONTROLADO
LO DAN POR EXTINGUIDO, RETIRA TODO EL PERSONAL.",,"431301N","052053W","7","02/03/2026 00:19","SALA 112"
,,"19/03/2026 16:17",,"Pandiella",,,,,"Extinguido",,"19/03/2026 17:33",,,"43º10'36""","005º23'58""","25","20/03/2026 15:30","SALA 112"
,,"24/03/2026 16:56",,"NIEVES",,,,,"Extinguido",,"24/03/2026 22:28",,"Nadie",,,"10","25/03/2026 14:10","SALA 112"
,,"24/03/2026 17:30",,"LA FELGUERINA",,,,,"Extinguido",,"24/03/2026 19:43","QUEMAN 30 METROS CUADRADOS DE MATORRAL",,"43 09 05","05 22 26",,"24/03/2026 19:49","SALA 112"
,,"13/03/2026 13:44",,"EL FORCÓN",,,,,"Extinguido",,"13/03/2026 13:44",,,,,,"13/03/2026 14:59","SALA 112"
,,"24/03/2026 18:05",,"LASTRES, CERCA DEL FARO",,,,,"Extinguido",,"24/03/2026 18:05","QUEMARON 100 METROS LINEALES DE MATORRAL",,,,,"24/03/2026 20:32","SALA 112"
,,"03/03/2026 20:09",,"FOMBONA ","2 BB AVILES + 1 BB PRAVIA",,,,"Extinguido","Bajo (0)","04/03/2026 00:20","FUEGO PROXIMO A LA CARRETERA, ZONA DE ARBOLADO,.
QUEMA UNA HILERA DE PINOS",,"43º 36´ 47""","5º 49´ 49""","0,05","04/03/2026 00:30","SALA 112"
,,"01/03/2026 14:38",,"RESTIELLO-VILLAZOY",,,,,"Extinguido","Moderado (1)","01/03/2026 17:23","EXTINGUIDO",,"43.2706","-6.1758","2","01/03/2026 18:25","SALA 112"
,,"01/03/2026 15:32",,"LA TEJERA - SOMBRONES",,,,,"Extinguido",,"01/03/2026 17:38",,,"43.2665","-6.1692","3","01/03/2026 18:25","SALA 112"
,,"01/03/2026 18:11",,"VILLAMARIN DE SALCEDO",,,,,"Extinguido","Bajo (0)","01/03/2026 19:09","LO DAN EXINGUIDO",,,,"1","01/03/2026 19:21","SALA 112"
,,"02/03/2026 14:43",,"VILLAZHOY",,,,,"Extinguido",,"02/03/2026 14:43",,"Guardería","43º  19´ 14¨  ","6º  5´  49¨ ","1","02/03/2026 21:43","SALA 112"
,,"03/03/2026 17:21",,"TRILLAPEÑA","2 BB GRADO + GUARDERIA",,,,"Extinguido","Bajo (0)","03/03/2026 17:21","BB01 INFORMA A LAS 18:06 QUE LLEVAN QUEMADAS ENTRE 4 Y 5 HA DE MATORRAL",,"43º 18´ 49""","6º 5´ 55""","4","03/03/2026 21:20","SALA 112"
,,"03/03/2026 23:14",,"Rubiano",,,,,"Extinguido","Bajo (0)","04/03/2026 00:47","ALERTANTE LO VE DESDE MUY LEJOS. DA UNA UBICACIÓN APROXIMADA. SIN MÁS DATOS.
00:47 H. BB. GRADO EN LA ZONA. QUEMA MATORRAL.
02:22 H. BB. GRADO INFORMAN DE INCENDIO EXTINGUIDO.",,"43.3067","-6.1079","6","04/03/2026 02:24","SALA 112"
,,"04/03/2026 19:29",,"LLAMAS",,,,,"Extinguido","Bajo (0)","04/03/2026 19:29",,,,,,"04/03/2026 21:59","SALA 112"
,,"05/03/2026 10:55",,"LAS MURIAS",,,,,"Extinguido",,"05/03/2026 10:55",,,,,,"05/03/2026 12:48","SALA 112"
,,"13/03/2026 10:44",,"RESTIELLO",,,,,"Extinguido",,"13/03/2026 10:44",,,"43º17´21´´","6º10´49´´",,"13/03/2026 12:15","SALA 112"
,,"17/03/2026 15:59",,"VILLAHIZOY",,,,,"Extinguido",,"17/03/2026 15:59",,,,,,"18/03/2026 02:19","SALA 112"
,,"17/03/2026 18:31",,"ROZALLANA",,,,,"Extinguido",,"17/03/2026 18:31",,,,,,"18/03/2026 00:00","SALA 112"
,,"19/03/2026 21:01",,"Murias",,,,,"Extinguido",,"19/03/2026 21:12",,,"43º19'12""","06º5'31""",,"20/03/2026 02:48","SALA 112"
,,"20/03/2026 14:51",,"VILLAHIZOY","BB LO DAN POR EXTINGUIDO",,,,"Extinguido","Bajo (0)","20/03/2026 19:10",,,,,"2","20/03/2026 19:56","SALA 112"
,,"21/03/2026 11:38",,"BARZANA",,,,,"Extinguido",,"21/03/2026 18:05","FLANCO IZQUIERDO APAGADO.
POSIBLEMENTE REALIZARÁN CONTRAFUEGO EN FLANCO DERECHO.
17:34 LO DAN POR CONTROLADO
18:05 EXTINGUIDO",,,,"4","21/03/2026 21:04","SALA 112"
,,"21/03/2026 17:20",,"El Merín de Arriba",,,,,"Extinguido",,"21/03/2026 21:12","RETIRAN TODOS",,"43 22 27 N","6 03 16 O","3","21/03/2026 21:55","SALA 112"
,,"21/03/2026 22:06",,"BALLONGO",,,,,"Extinguido",,"22/03/2026 10:11",,,,,,"22/03/2026 10:20","SALA 112"
,,"24/03/2026 18:52",,"VILLANDÁS",,,,,"Extinguido","Bajo (0)","24/03/2026 21:55",,,,,"10","25/03/2026 01:31","SALA 112"
,,"24/03/2026 22:15",,"RUBIANO",,,,,"Extinguido","Bajo (0)","24/03/2026 22:15",,,,,"2,5","25/03/2026 00:49","SALA 112"
,,,,"La Mesa","BB GRANDAS DE SALIME",,,,"Extinguido",,,,,"43.21777870253468","-6.8105220858063165",,"26/02/2026 07:33","ADRIAN CASTRO LEIVA"
,,"01/03/2026 19:24",,"LADA- PANDO LA LLANA",,,,,"Extinguido",,"01/03/2026 21:15","VARIOS FOCOS DE FUEGO EN EL MONTE. 21:15 EXTINGUIDO",,,,"0,25","01/03/2026 21:23","SALA 112"
,,"20/03/2026 15:42",,"Lada - detrás del cementerio.",,,,,"Extinguido",,"20/03/2026 21:16","P. LOCAL INDICA QUE SE HA REACTIVADO","Nadie",,,"1,5","21/03/2026 09:09","SALA 112"
,,,,"Pico La Vara",,,,,"Extinguido",,"26/02/2026 13:30",,,"43.234528","-5.592809","60","26/02/2026 13:30","SALA 112"
,,,,"Los Tornos",,,,,"Extinguido",,,,,,,,"25/02/2026 16:59","ADRIAN CASTRO LEIVA"
,,,,"Ferrera",,,,,"Extinguido",,"26/02/2026 12:24",,,"43.25448417489461","-5.512056811505801","2","26/02/2026 12:25","SALA 112"
